{
  "event_id": "E2026-04-15-001",
  "asset_id": "CONDENSER_TRAIN_A",
  "subgraph_id": "KGCTX::E2026-04-15-001::CONDENSER_TRAIN_A",
  "generated_at": "2026-04-15T14:11:00Z",
  "hop_limit": 3,
  "components": [
    {
      "component_id": "CMP_COND_A",
      "seed_match_type": "seed"
    },
    {
      "component_id": "CMP_AIRRM_A",
      "seed_match_type": "telemetry"
    },
    {
      "component_id": "CMP_HOTWELL_A",
      "seed_match_type": "topology"
    },
    {
      "component_id": "CMP_FWCV_A",
      "seed_match_type": "telemetry"
    },
    {
      "component_id": "CMP_AC12_HVAC",
      "seed_match_type": "support_system"
    }
  ],
  "upstream_paths": [
    {
      "path_id": "PATH_001",
      "nodes": ["CMP_COND_A", "CMP_AIRRM_A"],
      "edges": [
        {
          "from_node": "CMP_COND_A",
          "to_node": "CMP_AIRRM_A",
          "edge_type": "connected_support"
        }
      ]
    },
    {
      "path_id": "PATH_002",
      "nodes": ["CMP_COND_A", "CMP_HOTWELL_A"],
      "edges": [
        {
          "from_node": "CMP_COND_A",
          "to_node": "CMP_HOTWELL_A",
          "edge_type": "process_flow"
        }
      ]
    },
    {
      "path_id": "PATH_003",
      "nodes": ["CMP_HOTWELL_A", "CMP_FWCV_A"],
      "edges": [
        {
          "from_node": "CMP_HOTWELL_A",
          "to_node": "CMP_FWCV_A",
          "edge_type": "process_flow"
        }
      ]
    },
    {
      "path_id": "PATH_004",
      "nodes": ["CMP_AC12_HVAC", "CMP_AIRRM_A"],
      "edges": [
        {
          "from_node": "CMP_AC12_HVAC",
          "to_node": "CMP_AIRRM_A",
          "edge_type": "support_environment"
        }
      ]
    }
  ],
  "failure_modes": [
    {
      "fm_id": "FM_AIR_INLEAK",
      "component_id": "CMP_AIRRM_A",
      "name": "Air in-leakage or degraded air removal performance"
    },
    {
      "fm_id": "FM_COND_FOULING",
      "component_id": "CMP_COND_A",
      "name": "Condenser tube fouling / reduced heat transfer"
    },
    {
      "fm_id": "FM_FWCV_INSTAB",
      "component_id": "CMP_FWCV_A",
      "name": "Feedwater control valve instability"
    },
    {
      "fm_id": "FM_VAC_INST_BIAS",
      "component_id": "CMP_AIRRM_A",
      "name": "Vacuum instrumentation drift or bias"
    },
    {
      "fm_id": "FM_HVAC_SUPPORT_DEGRAD",
      "component_id": "CMP_AC12_HVAC",
      "name": "Support HVAC degradation affecting instrumentation cabinet environment"
    }
  ],
  "past_events": [
    {
      "event_id": "PE_2025_11_014",
      "asset_id": "CONDENSER_TRAIN_A",
      "component_id": "CMP_AIRRM_A",
      "timestamp_start": "2025-11-04T09:10:00Z"
    },
    {
      "event_id": "PE_2025_08_032",
      "asset_id": "CONDENSER_TRAIN_A",
      "component_id": "CMP_COND_A",
      "timestamp_start": "2025-08-17T07:00:00Z"
    },
    {
      "event_id": "PE_2025_12_021",
      "asset_id": "CONDENSER_TRAIN_A",
      "component_id": "CMP_FWCV_A",
      "timestamp_start": "2025-12-09T13:45:00Z"
    }
  ],
  "documents": [
    {
      "doc_id": "CR:SEC:2026:1042",
      "doc_type": "CR"
    },
    {
      "doc_id": "WO:SEC:2026:5518",
      "doc_type": "WO"
    },
    {
      "doc_id": "SOP:COND:201",
      "doc_type": "SOP"
    },
    {
      "doc_id": "CR:HVAC:2026:0771",
      "doc_type": "CR"
    }
  ],
  "seed_context": {
    "asset_ids": ["CONDENSER_TRAIN_A"],
    "seed_component_ids": ["CMP_COND_A", "CMP_AIRRM_A"],
    "monitored_variables": [
      "condenser_vacuum",
      "turbine_backpressure",
      "hotwell_level",
      "feedwater_flow",
      "cabinet_temperature"
    ]
  }
}