{
  "event_id": "E2026-01-23-001",
  "asset_id": "PUMP_A_01",
  "subgraph_id": "KGCTX::E2026-01-23-001::PUMP_A_01",
  "components": [
    {
      "component_id": "CMP_BRG",
      "seed_match_type": "seed"
    }
  ],
  "upstream_paths": [],
  "failure_modes": [
    {
      "fm_id": "FM_BEARING_WEAR",
      "component_id": "CMP_BRG",
      "name": "Bearing wear"
    }
  ],
  "past_events": [],
  "documents": [
    {
      "doc_id": "CR:DEMO:0001",
      "doc_type": "CR"
    }
  ],
  "seed_context": {
    "asset_ids": [
      "PUMP_A_01"
    ],
    "seed_component_ids": [
      "CMP_BRG"
    ],
    "monitored_variables": []
  }
}